老街名稱,地址,景點特色,必吃美食,大眾交通,Google Map
廣盛老街,苗栗縣三義鄉廣盛老街,"1.3D彩繪天梯
2.具有客家精神的圖騰塗鴉",廣盛老街糕餅，廣盛豆干，紅茶凍奶,可搭乘台中市公車至「廣盛」站下車，步行即可抵達。,https://maps.app.goo.gl/Q66NTjhKVJ9P231t6
南屯老街,台中市南屯區南屯路二段676號,"1.老廟福德寺、古蹟萬和宮
2. 紅磚老店永成雜貨店",南屯酥餅，豬血糕湯，南屯豆花,可搭乘台中市公車至「南屯區公所」站下車，步行即可抵達。,https://maps.app.goo.gl/XVog9S8a5GNBcPhE8
梧棲老街,台中市梧棲區梧棲老街,"1.彩繪互動牆
2.百年廟宇和日式特色建築",梧棲米糕，鱔魚意麵，梧棲紅茶,可搭乘台中市公車至「梧棲」站下車，步行即可抵達。,https://maps.app.goo.gl/79WJCYMELGEKGwWL9
大里老街,台中市大里區大里老街,"1.亭仔腳式街屋建築
2.大里杙碼頭遺址",大里肉圓，大里米糕湯，麻辣火雞腳,可搭乘台中市公車至「大里轉運站」，再轉乘市區公車或步行至大里老街。,https://maps.app.goo.gl/WVhy4UmPxBNCCEKZ8
鹿港老街,彰化縣鹿港鎮瑤林街9號,"1.閩南風味古早老宅
2.可以穿旗袍光逛街",鹿港香腸，魚丸湯，草仔粿,可搭乘高鐵至「嘉義高鐵站」，再轉乘巴士至「鹿港」站下車，步行即可抵達鹿港老街。,https://maps.app.goo.gl/6S3ycvNa2X4CeZk77
斗六太平老街,雲林縣斗六市太平路123號,"1.巴洛克式風格建築
2.三級古蹟",太平麻糬，斗六米糕，豆花冰,可搭乘火車至「斗六火車站」，再轉乘市區公車或步行至太平老街。,https://maps.app.goo.gl/kZigMpXPEkSJQfyP6
西螺延平老街,雲林縣西螺鎮延平路130號往東,"1.福興宮
2.捷發乾記茶莊，最豪華洋樓",延平鹹酥雞，蚵仔煎，西螺米糕,可搭乘火車至「西螺火車站」，再轉乘市區公車或步行至延平老街。,https://maps.app.goo.gl/UUqC3A4H3DkinKqw7
北港老街,雲林縣北港鎮中山路,"1.北港朝天宮
2.日興堂喜餅",北港肉圓，北港米糕，蓮霧冰,可搭乘火車至「北港火車站」，步行即可抵達北港老街。,https://maps.app.goo.gl/MX3D6fexggcNQNkR8
伊達邵碼頭老街,南投縣魚池鄉義勇街78號,"1.邵族文化老街
2.在日月潭周圍",海鮮炒飯，蚵仔煎，炸物拼盤,可搭乘火車至「伊達邵火車站」，再轉乘市區公車或步行至伊達邵碼頭老街。,https://maps.app.goo.gl/68QSr1cRk44fHqZC8
